,Unnamed: 0,producto,precio,cantidad,medida,cantidad_,categoria,supermercado
2081,3140,Desodorante en spray aloe vera Rexona 250 ml.,3.09,0.249,L,2.492,desodorante,carrefour
2082,3141,Preservativos placer prolongado Durex 12 ud.,6.89,9.986,ud,9.986,preservativos,carrefour
2083,3144,Agua de colonia clasica Amalfi 750 ml.,1.4,0.737,L,7.368,agua otro,carrefour
2084,3145,Champu en seco todo tipo de cabellos Volumen Carrefour 150 ml.,2.09,0.15,L,1.504,champu,carrefour
2085,3147,Preservativos dame placer Durex 12 ud.,6.89,12.088,ud,12.088,preservativos,carrefour
2086,3148,Preservativos sensacion piel con piel Durex 12 ud.,10.45,12.011,ud,12.011,preservativos,carrefour
2087,3149,Dentifrico para dientes sensibles Proteccion Diaria Sensodyne 75 ml.,3.5,0.075,L,0.749,dentifrico,carrefour
2088,3151,Gel de ducha hidratante smoothie passion Cottage 250 ml.,2.09,0.249,L,2.488,gel de ducha,carrefour
2089,3153,Dentifrico encias sensibles revitalizantes detox uso diario antibacteriano Encias Colgate 75 ml.,4.19,0.075,L,0.75,dentifrico,carrefour
2090,3155,Desodorante roll-on antitranspirante 48h 0% Alcohol Original Dove 50 ml.,1.7,0.05,L,0.5,desodorante,carrefour
2091,3156,Aceite extraordinario de coco tratamiento uso universal para pelo normal a seco L'Oreal Elvive 100 ml.,8.25,0.1,L,1.0,sal,carrefour
2092,3159,Agua de colonia glicerina y te blanco Heno de Pravia 780 ml.,2.59,0.647,L,6.475,agua otro,carrefour
2093,3160,Champu Rizos Definidos reconstructor de queratina para pelo rizado seco y apagado Pantene Pro-V 270 ml.,4.19,0.27,L,2.703,espaguetis,carrefour
2094,3162,Desodorante stick ecologico Piedra de Alumbre nbd 120 g.,3.55,0.12,kg,1.199,desodorante,carrefour
2095,3163,Champu fortificante Nutri Rizos Contouring para cabello rizado u ondulado Garnier-Fructis 690 ml.,6.31,0.693,L,6.934,champu,carrefour
2096,3164,Dentifrico sabor fresa desde 7 anos Carrefour 75 ml.,0.86,0.075,L,0.748,dentifrico,carrefour
2097,3165,Champu purificante para todo tipo de pelo Pantene Pro-V 700 ml.,5.69,0.703,L,7.025,champu,carrefour
2098,3168,Champu fortificante Pure Fresh Menta Refrescante Anticaspa Garnier-Fructis 360 ml.,3.32,0.361,L,3.609,champu,carrefour
2099,3170,Champu Repara y Protege reconstructor de queratina para pelo danado. seco y apagado Pantene Pro-V 270 ml.,3.58,0.269,L,2.692,champu,carrefour
2100,3172,Gel de ducha dermo aceite para piel normal-seca BiomeProtect Sanex 900 ml.,3.49,0.895,L,8.949,gel de ducha,carrefour
2101,3178,Champu violeta Fuerza & Anti-Tonos anaranjados con biotina + proteina de seda hidrolizada Miracles Pantene Pro-V 225 ml.,4.19,0.225,L,2.253,champu,carrefour
2102,3179,Toallitas desmaquillantes suaves Nectar of Bio 25 ud.,1.8,25.714,ud,25.714,zumo,carrefour
2103,3180,Desodorante roll-on antitranspirante 48h 0% Alcohol Original Dove 50 ml.,1.7,0.05,L,0.5,desodorante,carrefour
2104,3181,Champu solido Tesoros de miel para cabello danado y quebradizo Original Remedies Garnier 60 g.,3.99,0.06,kg,0.6,miel,carrefour
2105,3184,Champu anticaspa y gel de ducha sport con esencia de sandalo para pelo. cuerpo y cara H&S 300 ml.,4.19,0.299,L,2.993,gel de ducha,carrefour
2106,3185,Dentifrico control Duplo Parogencyl pack de 2 unidades de 125 ml.,6.89,0.25,L,2.496,dentifrico,carrefour
2107,3186,Enjuague bucal blanqueador Avanced White Listerine 500 ml.,5.45,0.5,L,5.0,enjuague bucal,carrefour
2108,3192,Bomba de sal IDC Institute 1 ud.,1.71,0.14,kg,1.402,sal,carrefour
2109,3193,Crema hidratante para cara y cuerpo Care Nivea 400 ml.,5.19,0.399,L,3.992,crema hidratante,carrefour
2110,3195,Agua de colonia Don Algodon 200 ml.,11.9,0.2,L,2.0,agua otro,carrefour
2111,3197,Compresas para incontinencias de orina extra Discreet Tena 20 ud.,6.45,20.156,ud,20.156,compresas,carrefour
2112,3198,Desodorante en spray original 0% sales de aluminio Dove 200 ml.,3.85,0.2,L,2.005,desodorante,carrefour
2113,3200,Desodorante en spray anti-machas fragancia exotica a limones del Caribe proteccion 48h Fa 200 ml.,3.59,0.201,L,2.006,desodorante,carrefour
2114,3202,Gel de afeitar suave Gillette Mach3 200 ml.,3.7,0.2,L,2.0,gel de ducha,carrefour
2115,3204,Desodorante roll-on antitranspirante 48h 0% Alcohol Original Dove 50 ml.,1.7,0.05,L,0.5,desodorante,carrefour
2116,3206,Crema hidratante en lata Nivea 75 ml.,2.09,0.075,L,0.749,crema hidratante,carrefour
2117,3207,Champu Hair Food aloe vera hidratante Garnier-Fructis 350 ml.,4.69,0.35,L,3.5,champu,carrefour
2118,3208,Mascarilla capilar antiencrespamiento con aceite de aguacate y manteca de karite Garnier Original Remedies 300 ml.,3.79,0.301,L,3.008,agua otro,carrefour
2119,3209,Acondicionador suave con perfume de flor de tiare y jugo de aloe vera ecologico Nectar Of Bio 200 ml.,2.99,0.201,L,2.007,zumo,carrefour
2120,3210,Dentifrico con fluor de uso diario Frescor Diario Parodontax 75 ml.,4.75,0.075,L,0.75,dentifrico,carrefour
2121,3213,Gel limpiador detox con citronela ecologico Garnier 150 ml.,5.95,0.15,L,1.499,gel de ducha,carrefour
2122,3215,Enjuague bucal advance white menta Listerine 1 l.,10.15,0.995,L,9.951,enjuague bucal,carrefour
2123,3216,Dentifrico Encias Alivia & Repara Colgate 75 ml.,4.85,0.075,L,0.75,dentifrico,carrefour
2124,3217,Desodorante roll-on Active Control 48h Sanex Men 50 ml.,1.99,0.05,L,0.5,desodorante,carrefour
2125,3220,Crema hidratante corporal con argan Carrefour Soft 250 ml.,1.8,0.25,L,2.5,crema hidratante,carrefour
2126,3222,Cepillo de dientesbamboo soft ecologico Soft Carrefour 1 ud.,1.99,1.0,ud,1.0,cepillo de dientes,carrefour
2127,3225,Desodorante roll-on dermo invisible 24h antitranspirante Sanex Men 50 ml.,1.99,0.045,L,0.45,desodorante,carrefour
2128,3226,Gel de ducha hidratante para piel sensible Zero% Sanex 600 ml.,3.09,0.606,L,6.059,gel de ducha,carrefour
2129,3227,Tampones super ecologicos Carrefour 32 ud.,2.2,31.429,ud,31.429,tampones,carrefour
2130,3228,Desodorante roll-on antitranspirante 48h 0% Alcohol Original Dove 50 ml.,1.7,0.05,L,0.5,desodorante,carrefour
2131,3229,Toallitas desodorantes Carrefour 12 ud. ,0.6,12.0,ud,12.0,desodorante,carrefour
2132,3230,Enjuague bucal 0% alcohol ecologico Carrefour Soft Bio 500 ml.,2.99,0.498,L,4.983,enjuague bucal,carrefour
2133,3231,Desodorante en spray Protege & Cuida Nivea 250 ml.,3.49,0.249,L,2.493,desodorante,carrefour
2134,3232,Dentifrico para dientes sensible Accion Completa Sensodyne 75 ml.,4.05,0.075,L,0.75,dentifrico,carrefour
2135,3234,Gel de ducha Pure Micelar Skin Care Natural Honey 750 ml.,2.25,0.75,L,7.5,gel de ducha,carrefour
2136,3236,Gel fijador fuerte efecto mojadoWet Look Garnier Fructis 200 ml.,2.75,0.201,L,2.007,gel de ducha,carrefour
2137,3237,Preservativos Nature Happy Sex 12 ud.,3.09,11.885,ud,11.885,preservativos,carrefour
2138,3238,Desodorante en spray Fresh Apollo 48h Axe 150 ml.,2.09,0.15,L,1.504,desodorante,carrefour
2139,3239,Preservativos finissimo original Control 12 ud.,7.19,11.983,ud,11.983,preservativos,carrefour
2140,3240,Dentifrico blanqueador Max White Expert Original Colgate 75 ml.,4.19,0.075,L,0.75,dentifrico,carrefour
2141,3242,Gel de ducha dermo aceite para piel normal-seca BiomeProtect Sanex 600 ml.,3.09,0.606,L,6.059,gel de ducha,carrefour
2142,3246,Dentifrico para dientes sensibles Blanqueante Sensodyne 75 ml.,3.5,0.075,L,0.749,dentifrico,carrefour
2143,3247,Desodorante en spary invisible dry anti-transpirante 48h. Dove 250 ml.,4.07,0.25,L,2.497,desodorante,carrefour
2144,3251,Compresas adulto Absodys Carrefour 28 ud.,3.15,28.636,ud,28.636,compresas,carrefour
2145,3252,Champu reconstructor para cabello largo y danado Dream Long L'Oreal Elvive 690 ml.,7.05,0.691,L,6.912,champu,carrefour
2146,3253,Desodorante roll-on antitranspirante 48h 0% Alcohol Original Dove 50 ml.,1.7,0.05,L,0.5,desodorante,carrefour
2147,3254,Crema de dia antiarrugas con manteca de karite para pieles secas ecologica Nectar Of Bio 30 ml.,2.85,0.03,L,0.3,zumo,carrefour
2148,3258,Champu fortificante fuerza y brillo para cabello normal Ganier Fructis 690 ml.,6.31,0.693,L,6.934,champu,carrefour
2149,3259,Crema hidratante intensiva multiuso con aceite de jojoba y vitamina E Nivea Soft Mini formato de viaje 50 ml.,1.06,0.05,L,0.5,crema hidratante,carrefour
2150,3260,Champu nutricion extrema Oliva Mitica para pelo seco Original Remedies Garnier 600 ml.,5.29,0.601,L,6.011,champu,carrefour
2151,3261,Agua de colonia familiar Puig 750 ml.,3.55,0.755,L,7.553,agua otro,carrefour
2152,3263,Champu anticaspa Menthol Fresh H&S 650 ml.,6.19,0.652,L,6.516,champu,carrefour
2153,3264,Desodorante en spray Black Axe pack de 2 unidades de 200 ml.,7.55,0.4,L,3.995,desodorante,carrefour
2154,3265,Champu reductor de canas con aloe vera y aceite de coco Control GX Just For Men 118 ml.,9.65,0.118,L,1.18,champu,carrefour
2155,3266,Compresas Cottonlike normal sin alas Evax 20 ud.,2.85,20.357,ud,20.357,compresas,carrefour
2156,3269,Compresas incontinencia maxi Indasec 15 ud.,5.95,14.875,ud,14.875,compresas,carrefour
2157,3271,Dentifrico blanqueador Fluocaril pack de 2 unidades de 75 ml.,7.09,0.15,L,1.499,dentifrico,carrefour
2158,3272,Champu Suave & Liso para pelo encrespado o apagado Pantene 1000 ml.,10.35,1.005,L,10.049,champu,carrefour
2159,3275,Tampones sin aplicador normal ecologicos Carrefour Eco Planet 24 ud.,1.8,25.714,ud,25.714,tampones,carrefour
2160,3276,Dentifrico protect esmalte y anticaries Dentalyss 75 ml.,0.71,0.075,L,0.747,dentifrico,carrefour
2161,3277,Gel de ducha exfoliante Carrefour 500 ml.,2.19,0.498,L,4.977,gel de ducha,carrefour
2162,3278,Desodorante roll-on antitranspirante 48h 0% Alcohol Original Dove 50 ml.,1.7,0.05,L,0.5,desodorante,carrefour
2163,3279,Gel de ducha Leche Carrefour 750 ml.,1.2,0.75,L,7.5,gel de ducha,carrefour
2164,3280,Desodorante en spray Cobalty Dry Rexona 250 ml. ,3.09,0.249,L,2.492,desodorante,carrefour
2165,3281,Agua de colonia Hombre Don Algodon 200 ml.,11.9,0.2,L,2.0,agua otro,carrefour
2166,3284,Champu. acondicionador y tratamiento 3en1 Suave & Liso suavidad y control encrespamiento Pro-V Pantene 675 ml.,7.25,0.678,L,6.776,champu,carrefour
2167,3286,Enjuague bucal diario para el cuidado de encias Extra Fresh Parodontax 500 ml.,7.09,0.499,L,4.993,enjuague bucal,carrefour
2168,3289,Dentifrico Fresh xtrem Dentalyss 75 ml.,0.71,0.075,L,0.747,dentifrico,carrefour
2169,3290,Champu suave con perfume de flor de tiare y jugo de aloe vera ecologico Nectar Of Bio 200 ml.,2.39,0.249,L,2.49,champu,carrefour
2170,3292,Enjuague bucal menta fresca Listerine 500 ml.,5.18,0.498,L,4.981,enjuague bucal,carrefour
2171,3293,Champu Camolina & Trigo para cabello rubio Les Cosmetiques -Nectar of Beauty 500 ml.,2.09,0.402,L,4.019,champu,carrefour
2172,3300,Desodorante roll-on antitranspirante 48h 0% Alcohol Original Dove 50 ml.,1.7,0.05,L,0.5,desodorante,carrefour
2173,3302,Serum facial firmeza con orquidea ecologico Nectar Of Bio Les Comestique 30 ml.,3.39,0.03,L,0.3,zumo,carrefour
2174,3304,Compresas para pequenas perdidas de orina ' Absodys Control ' normal Carrefour 12 ud.,2.09,12.294,ud,12.294,compresas,carrefour
2175,3305,Tinte 7.5 rubio dorado caramelo Intensive Color Cream Palette 1 ud.,3.92,1.0,ud,1.0,caramelos,carrefour
2176,3306,Compresas para incontinencia maxi Discreet Tena 12 ud.,6.69,11.946,ud,11.946,compresas,carrefour
2177,3309,Champu anticaspa Nutre & Cuida H&S 650 ml.,6.19,0.652,L,6.516,champu,carrefour
2178,3310,Crema hidratante aguacate para piel seca Naturally Good Nivea 350 ml.,5.29,0.35,L,3.503,agua otro,carrefour
2179,3312,Compresas ultra fina con altas super + refresh Carrefour 12 ud.,1.71,12.214,ud,12.214,compresas,carrefour
2180,3318,Colonia spray fresca y ligera con notas citricas y hojas de te y jazmin Carrefour Soft 200 ml.,2.35,0.201,L,2.009,colonia,carrefour
2181,3320,Gel de ducha de coco addiction Natural Honey 75 ml.,1.06,0.075,L,0.752,gel de ducha,carrefour
2182,3321,Gel de ducha Pamplemousse Rose Cottage 250 ml.,1.99,0.249,L,2.488,gel de ducha,carrefour
2183,3323,Desodorante roll-on antitranspirante 48h 0% Alcohol Original Dove 50 ml.,1.7,0.05,L,0.5,desodorante,carrefour
2184,3324,Estuche Adidas: colonia Ice Dive 100 ml y colonia Get Ready 100 ml. ,14.45,1.0,ud,1.0,colonia,carrefour
2185,3327,Crema de noche antiarrugas reafirmante & alisadora con manteca de karetine para piles secas ecologica Nectar Of Bio 30 ml.,2.99,0.03,L,0.3,zumo,carrefour
2186,3328,Tampones con aplicador super Carrefour 20 ud.,1.35,19.286,ud,19.286,tampones,carrefour
2187,3332,Champu. acondicionador y tratamiento 3en1 Cuidado Clasico Pro-V Pantene 675 ml.,7.25,0.678,L,6.776,champu,carrefour
2188,3333,Champu. acondicionador y tratamiento 3en1 para rizos brillantes y flexibles Pro-V Pantene 675 ml.,7.25,0.678,L,6.776,champu,carrefour
2189,3337,Agua de peinado Nelly 200 ml.,2.49,0.201,L,2.008,agua otro,carrefour
2190,3339,Champu alisadora macadamia Garnier 350 ml.,4.75,0.349,L,3.493,champu,carrefour
2191,3340,Champu solido hidratante de coco y aloe vera ecologico Original Remedies Garnier 60 g.,4.59,0.06,kg,0.6,champu,carrefour
2192,3345,Agua de perfume fragancia vainilla Carrefour Soft 100 ml.,3.32,0.1,L,1.0,agua otro,carrefour
2193,3347,Gel lubricante intimo Classic Natural Intimy 70 ml.,6.79,0.07,L,0.7,gel de ducha,carrefour
2194,3348,Desodorante roll-on antitranspirante 48h 0% Alcohol Original Dove 50 ml.,1.7,0.05,L,0.5,desodorante,carrefour
2195,3349,Gel de ducha Badedas 750 ml.,11.49,0.751,L,7.51,gel de ducha,carrefour
2196,3350,Desodorante en spray Black&White Invisible Active Nivea Men 250 ml.,3.49,0.249,L,2.493,desodorante,carrefour
2197,3352,Crema hidratante Anti-Fatiga Hydra Energetic L'Oreal-Men Expert 50 ml.,6.95,0.05,L,0.5,crema hidratante,carrefour
2198,3353,Champu para cabellos blancos con extracto de magnolia Silver Shine Science 300 ml.,2.85,0.3,L,3.0,champu,carrefour
2199,3354,Crema de manos hidratante manos normales o secas Carrefour 100 ml.,0.99,0.1,L,1.0,crema hidratante,carrefour
2200,3356,Tampones con aplicador normal Carrefour 20 ud.,1.35,19.286,ud,19.286,tampones,carrefour
2201,3357,Agua de peinado Carrefour 150 ml.,1.58,0.15,L,1.505,agua otro,carrefour
2202,3359,Tonico facial detox para todo tipo de pieles ecologico Nectar Of Bio 200 ml.,2.59,0.201,L,2.008,zumo,carrefour
2203,3365,Compresas para incontinencia maxi night Discreet Tena 12 ud.,7.09,12.017,ud,12.017,compresas,carrefour
2204,3367,Gel de ducha dermatologico piel atopica Pharmaline 750 ml.,5.55,0.75,L,7.5,gel de ducha,carrefour
2205,3370,Preservativos sensitivo contacto total Durex 12 ud.,10.19,11.988,ud,11.988,preservativos,carrefour
2206,3372,Leche desmaquillante suave con extracto de alga para todo tipo de pieles ecologica Nectar Of Bio 200 ml.,2.6,0.2,L,2.0,zumo,carrefour
2207,3373,Desodorante roll-on antitranspirante 48h 0% Alcohol Original Dove 50 ml.,1.7,0.05,L,0.5,desodorante,carrefour
2208,3374,Desodorante roll-on flor de tiare y monoi Carrefour soft 50 ml.,0.8,0.05,L,0.5,desodorante,carrefour
2209,3375,Laca fijadora para cabellos tenidos y tratados Sunsilk 400 ml.,2.49,0.402,L,4.016,espaguetis,carrefour
2210,3376,Crema facial hidratante suavidad y brillo ecologico Nectar of Bio Les Cosmetiques 50 ml.,4.99,0.05,L,0.5,zumo,carrefour
2211,3377,Desenredante capilar sin aclarado citrico y romero Soft Carrefour 200 ml.,2.09,0.201,L,2.01,romero,carrefour
2212,3380,Estuche Nike Sweet Blossom Woman: colonia 75 ml. colonia 30 ml. locion corporal 75 ml y gel de ducha 75 ml.,11.29,1.0,ud,1.0,gel de ducha,carrefour
2213,3383,Cepillo de dientes de bateria suave para ninos 2+ anos Minions Colgate 1 ud.,7.35,1.0,ud,1.0,cepillo de dientes,carrefour
2214,3384,Mascarilla capilar aceite de coco Carrefour Soft 300 ml.,2.09,0.299,L,2.986,aceite de coco,carrefour
2215,3385,Gel corporal con aloe vera Carrefour Soft 300 ml.,2.89,0.301,L,3.01,gel de ducha,carrefour
2216,3387,Leche corporal hidratante con extracto de avena Carrefour 400 ml.,1.86,0.404,L,4.043,leche de avena,carrefour
2217,3388,Champu 3 en 1 superalimento Pantene 675 ml.,7.25,0.647,L,6.473,champu,carrefour
2218,3389,Preservativos invisible super fino y extra sensitivo Durex 12 ud.,13.85,12.043,ud,12.043,preservativos,carrefour
2219,3390,Champu solido con aceite de almendra dulce para cabellos normales Carrefour Soft Green 75 g.,4.19,0.075,kg,0.75,champu,carrefour
2220,3392,Crema de noche hidratante nenufar blanco ecologico Nectar Of Bio Les Comestique50 ml.,2.99,0.05,L,0.5,zumo,carrefour
2221,3393,Agua de perfume fragancia mora Carrefour Soft 100 ml.,3.32,0.1,L,1.0,agua otro,carrefour
2222,3395,Champu para barba + cabello + rostro BarberClub L'Oreal-Men Expert 200 ml.,7.59,0.25,L,2.497,champu,carrefour
2223,3396,Desodorante roll-on antitranspirante 48h 0% Alcohol Original Dove 50 ml.,1.7,0.05,L,0.5,desodorante,carrefour
2224,3397,Agua de peinado desenredante para cabello Frozen II Disney 400 ml ,3.59,0.399,L,3.989,agua otro,carrefour
2225,3400,Crema facial de dia hidratante antiarrugas con aceite de semilla de uva y vitamina E Nivea 50 ml.,6.95,0.05,L,0.5,uvas,carrefour
2226,3405,Gel de afeitar anti-irritaciones Sensitive Nivea Men 200 ml.,4.59,0.2,L,2.004,gel de ducha,carrefour
2227,3407,Champu anticaspa y acondicionador Classic 2 en 1 H&S 650 ml.,6.19,0.652,L,6.516,champu,carrefour
2228,3410,Preservativos natural Durex 24 ud.,15.09,23.952,ud,23.952,preservativos,carrefour
2229,3411,Champu solido Delicatesse de Avena para cabello delicado Original Remedies Garnier 60 g.,3.85,0.06,kg,0.6,champu,carrefour
2230,3412,Mascarilla reparadora perfume de flor de tiare ecologico Nectar Of Bio Les Comestiques 200 ml.,2.99,0.201,L,2.007,zumo,carrefour
2231,3413,Desodorante en spray invisible Rexona 250 ml. ,3.09,0.249,L,2.492,desodorante,carrefour
2232,3418,Desodorante roll-on antitranspirante 48h 0% Alcohol Original Dove 50 ml.,1.7,0.05,L,0.5,desodorante,carrefour
2233,3419,Desodorante talco para pies Eudermin 150 ml.,3.55,0.15,L,1.498,desodorante,carrefour
2234,3432,Compresas para perdidas de orina extra Ausonia Discreet 10 ud.,3.89,9.974,ud,9.974,compresas,carrefour
2235,3433,Crema de manos hidratante proteccion cuidado intensivo con camomila Atrix 250 ml.,3.65,0.25,L,2.5,crema hidratante,carrefour
2236,3435,Champu anticaspa Suave & Sedoso H&S 650 ml.,6.19,0.652,L,6.516,champu,carrefour
2237,3438,Gel fijador efecto mojado Carrefour 250 ml.,1.38,0.251,L,2.509,gel de ducha,carrefour
2238,3439,Estuche de colonia nÂº 43 150 ml. + regalo 30 ml. Caravan 1 ud.,10.39,1.0,ud,1.0,colonia,carrefour
2239,3440,Crema facial hidratante antiedad FP15 Hyaluron Nivea Men 50 ml.,13.25,0.05,L,0.5,crema hidratante,carrefour
2240,3441,Gel lubricante extra sensitivo aloe vera naturals Durex 100 ml.,10.99,0.1,L,1.0,gel de ducha,carrefour
2241,3443,Desodorante roll-on antitranspirante 48h 0% Alcohol Original Dove 50 ml.,1.7,0.05,L,0.5,desodorante,carrefour
2242,3445,Desodorante en spray Cotton Dry Algodon Rexona 250 ml.,3.09,0.249,L,2.492,desodorante,carrefour
2243,3449,Compresas para perdidas de orina normal Ausonia Discreet 12 ud.,3.89,12.156,ud,12.156,compresas,carrefour
2244,3451,Compresas de incontinencia para hombre Absodys men Carrefour 20 ud.,7.25,20.139,ud,20.139,compresas,carrefour
2245,3452,Champu cabello rebelde Les Cosmetiques -Kera Science 400 ml.,1.7,0.405,L,4.048,champu,carrefour
2246,3453,Estuche Don Algodon Hombre: colonia 100 ml. after shave 75 ml. gel de ducha 75 ml y desodorante 150 ml.,11.95,1.0,ud,1.0,gel de ducha,carrefour
2247,3454,Champu anticaspa y acondicionador todo en uno Citrus Fresh para cabello graso H&S 540 ml.,6.65,0.541,L,5.407,champu,carrefour
2248,3462,Gel intima odor block Vagisil 250 ml.,6.55,0.25,L,2.5,gel de ducha,carrefour
2249,3464,Compresas ultrafinas con alas para la noche Carrefour 9 ud.,1.6,8.889,ud,8.889,compresas,carrefour
2250,3465,Tampones normal con aplicador suave Carrefour 20 ud.,2.4,20.0,ud,20.0,tampones,carrefour
2251,3466,Dentifrico con fluor de uso diario Blanqueante Diario Parodontax 75 ml.,4.75,0.075,L,0.75,dentifrico,carrefour
2252,3467,Crema para pies hidratante Carrefour Soft 125 ml.,1.55,0.125,L,1.25,crema hidratante,carrefour
2253,3468,Desodorante roll-on antitranspirante 48h 0% Alcohol Original Dove 50 ml.,1.7,0.05,L,0.5,desodorante,carrefour
2254,3470,Estuche Zinnia Classic Woman: colonia 100 ml. locion corporal 100 ml y crema de manos 75 ml.,15.05,1.0,ud,1.0,colonia,carrefour
2255,3475,Enjuague bucal proteccion dientes y encias sabor menta suave Listerine 500 ml.,5.18,0.498,L,4.981,enjuague bucal,carrefour
2256,3476,Desodorante en spray Cool Kick Nivea Men 250 ml.,3.49,0.249,L,2.493,desodorante,carrefour
2257,3478,Gel de afeitado femenino pieles sensibles con aloe vera Satin Care Sensitive Gillette 200 ml.,4.99,0.2,L,2.004,gel de ducha,carrefour
2258,3479,Aceite capilar reparacion con aceites de argan y jojoba ecologico Nectar Of Bio 50 ml.,3.99,0.05,L,0.5,zumo,carrefour
2259,3482,Agua de colonia Gotas Frescas Instituto Espanol 250 ml.,4.85,0.25,L,2.5,agua otro,carrefour
2260,3483,Agua de colonia nÂº 16 Amaderada oriental para hombre Caravan 150 ml.,9.7,0.15,L,1.499,agua otro,carrefour
2261,3484,Gel de ducha al extracto de frambuesa Carrefour Kids 300 ml.,1.61,0.298,L,2.981,gel de ducha,carrefour
2262,3485,Compresas para perdidas de orina maxi dia y noche Ausonia Discreet 12 ud.,6.15,12.059,ud,12.059,compresas,carrefour
2263,3488,Tampones super con aplicador suave Carrefour 18 ud.,2.16,18.0,ud,18.0,tampones,carrefour
2264,3493,Desodorante roll-on antitranspirante 48h 0% Alcohol Original Dove 50 ml.,1.7,0.05,L,0.5,desodorante,carrefour
2265,3495,3 Estropajos salvaunas Carrefour - Verde,0.65,2.955,ud,2.955,ajo,carrefour
2266,3506,Detergente liquido Original Ariel 50 lavados.,11.0,1.0,ud,50.0,detergente,carrefour
2267,3512,Lejia con detergente limon Especial Cocinas Carrefour 2 l.,0.95,2.021,L,2.021,detergente,carrefour
2268,3516,Gel wc eucalipto Carrefour 1 l.,0.99,1.0,L,1.0,gel de ducha,carrefour
2269,3517,Gel WC azul desincrustante Carrefour 1 l.,0.99,1.0,L,1.0,gel de ducha,carrefour
2270,3523,Lejia accion total Conejo 2 l.,1.9,2.0,L,2.0,conejo,carrefour
2271,3524,Limpiador de bano power gel Carrefour 1.5 l.,1.3,1.494,L,1.494,gel de ducha,carrefour
2272,3525,Detergente liquido Nenuco Colon 60 lavados.,9.25,1.0,ud,61.667,detergente,carrefour
2273,3527,Detergente liquido bebe sin alergenos Norit 1125 ml.,3.99,1.124,L,1.124,detergente,carrefour
2274,3532,Detergente liquido Colonia Fresca Carrefour 40 lavados.,2.67,1.0,ud,38.143,colonia,carrefour
2275,3533,Lejia perfumada con detergente Frescor Marino Carrefour 5 l.,1.8,5.0,L,5.0,detergente,carrefour
2276,3537,Sal para lavavajillas Carrefour 5 kg.,1.61,5.031,kg,5.031,sal,carrefour
2277,3543,Fregasuelos con lejia y detergente limon Estrella 1.35 l.,1.5,1.351,L,1.351,detergente,carrefour
2278,3545,Suavizante concentrado orquidea y vainilla Carrefour 80 lavados.,1.77,1.0,ud,88.5,vainilla,carrefour
2279,3550,Bolsas de congelacion grandes Carrefour 50 ud.,1.59,53.0,ud,53.0,gel de ducha,carrefour
2280,3552,Limpiador con lejia y detergente perfume eucalipto Carrefour 2 l.,0.76,2.0,L,2.0,detergente,carrefour
2281,3559,Set 3 Estropajos Salvaunas Antibacterias VILEDA Plus,2.59,2.008,ud,2.008,ajo,carrefour
2282,3567,Detergente liquido Alpine Ariel 50 lavados.,14.25,1.0,ud,50.893,detergente,carrefour
2283,3572,Fregasuelos con lejia y detergente azul Estrella 1.35 l.,1.5,1.351,L,1.351,detergente,carrefour
2284,3576,3 Estropajos Inox Carrefour - Metalizado,0.7,3.043,ud,3.043,ajo,carrefour
2285,3588,Gel desatascador tuberias Expert Carrefour 1 l.,1.75,1.0,L,1.0,gel de ducha,carrefour
2286,3589,Amoniaco perfumado con detergente Carrefour 1.5 l.,0.85,1.491,L,1.491,detergente,carrefour
2287,3590,Detergente liquido Compact Ariel 66 lavados,14.3,1.0,ud,65.0,detergente,carrefour
2288,3591,Fregasuelos multisuperficies universal con bioalcohol Tenn 1.3 l.,2.58,1.303,L,1.303,sal,carrefour
2289,3593,Sal para lavavajillas Finish 4 kg.,6.65,4.006,kg,4.006,sal,carrefour
2290,3601,Limpiacristales en pistola cristalino Cristasol 750 ml,2.15,0.749,L,0.749,alino,carrefour
2291,3609,Fregasuelos con lejia y detergente limon Estrella 2.7 l.,2.93,2.688,L,2.688,detergente,carrefour
2292,3622,Suavizante concentrado colonia Carrefour 80 lavados.,1.77,1.0,ud,88.5,colonia,carrefour
2293,3636,Bolsas de congelacion grandes Carrefour 15 ud.,1.24,15.5,ud,15.5,gel de ducha,carrefour
2294,3637,Detergente liquido prendas delicadas Norit 1125 ml.,3.69,1.125,L,1.125,detergente,carrefour
2295,3639,Desodorizante cisterna en pastilla agua Azul Carrefour 2 ud.,0.66,0.1,kg,0.1,agua otro,carrefour
2296,3640,Detergente en capsulas Todo en Uno Pods Ariel 37 lavados.,9.25,1.0,ud,37.0,detergente,carrefour
2297,3645,Gel WC 4en1 aroma fresco con lejia SaniCentro 1 l.,1.7,1.0,L,1.0,gel de ducha,carrefour
2298,3649,Limpiador de banos desinfectante manzana-hierbabuena sin lejia KH-7 750 ml.,2.95,0.751,L,0.751,manzanas,carrefour
2299,3662,Agua fuerte Salfumant Carrefour 1 l.,0.75,1.0,L,1.0,agua otro,carrefour
2300,3664,Detergente en polvo Elena 80 cacitos.,8.75,1.0,ud,79.545,detergente,carrefour
2301,3666,Detergente liquido aloe vera y flores de almendra dulce Carrefour 40 lavados.,3.31,1.0,ud,41.375,almendras,carrefour
2302,3667,Detergente liquido ropa oscura Diario Norit 40 lavados.,6.39,1.0,ud,39.938,detergente,carrefour
2303,3670,Limpiacristales cristalino recambio Cristasol 750 ml.,1.99,0.751,L,0.751,alino,carrefour
2304,3675,Detergente en capsulas marsellas y flores de naranjo Carrefour 30 ud.,5.15,1.0,ud,30.294,detergente,carrefour
2305,3677,Detergente liquido azul Wipp Express 50 lavados.,12.35,1.0,ud,49.4,detergente,carrefour
2306,3679,Detergente en polvo Ariel 85 cacitos,18.75,1.0,ud,85.227,detergente,carrefour
2307,3682,Detergente liquido delicate con jabon de marsella Carrefour Expert 40 lavados.,2.36,1.0,ud,39.333,detergente,carrefour
2308,3686,Quitamanchas liquido Vanish 1 l.,2.09,1.0,L,1.0,anis,carrefour
2309,3689,Detergente liquido azul Wipp Express 100 lavados.,19.95,1.0,ud,99.75,detergente,carrefour
2310,3694,Gel para lavavajillas Oro frescor anti-olor con vinagre Somat pack de 2 unidades de 50 lavados.,14.76,1.0,ud,98.4,gel de ducha,carrefour
