,Unnamed: 0,producto,precio,cantidad,medida,cantidad_,categoria,supermercado
2766,4959,Alimento Humedo para Gatos Pollo. Pato y Pavo 100 gr. Carrefour,0.32,0.1,kg,0.1,pechuga de pavo,carrefour
2767,4962,Comida humeda seleccion pescados en salsa para gatos Sheba Selezione pack de 4 unidades de 85 g.,2.49,0.34,ud,0.34,salsa,carrefour
2768,4969,Comida humeda de pavo para perro Beyond Grain Free 400 g.,2.15,0.4,kg,0.4,pechuga de pavo,carrefour
2769,4979,Snacks de queso y salmon para gatos Catisfactions 60 g.,1.47,0.06,kg,0.06,queso,carrefour
2770,4981,Comida humeda finas laminas de gelatina para gato adulto Purina Gourmet Perle 4x85 g.,3.09,0.34,kg,0.34,gel de ducha,carrefour
2771,4983,Pienso de pollo y arroz para perro adulto Ultima 3 Kg.,11.45,2.997,kg,2.997,arroz,carrefour
2772,4991,Comida humeda de pato. pollo y pavo para gato adulto Purina Gourmet Mon Petit 6x50g.,2.59,0.3,kg,0.3,pechuga de pavo,carrefour
2773,4993,Pienso Light de pollo y arroz para perros adultos Medium Maxi Ultima 3 Kg.,12.25,3.002,kg,3.002,arroz,carrefour
2774,4997,Pienso de salmon y arroz para perro adulto Mini Purina One Delicate 1.5 Kg.,5.89,1.499,kg,1.499,arroz,carrefour
2775,5006,Comida humeda de cordero y pollo para perro Pedigree 300 g.,1.82,0.3,kg,0.3,cordero,carrefour
2776,5009,Pienso semihumedo de aves. verduras y cereales para perros adultos mini Frolic 1 kg.,4.09,1.0,kg,1.0,cereales,carrefour
2777,5010,Pienso de pavo y arroz para perro adulto Mini Purina One Weigth 1.5 Kg.,5.89,1.499,kg,1.499,arroz,carrefour
2778,5021,Comida humeda de conejo para gato adulto Purina Gourmet Gold 85 g,0.73,0.085,kg,0.085,conejo,carrefour
2779,5023,Ultima Pienso para Gato Adulto Sabor salmon y arroz 3kg.,14.69,2.998,kg,2.998,arroz,carrefour
2780,5026,Comida humeda tartalette buey y tomate para gato adulto Purina Gourmet Gold85 g.,0.73,0.085,kg,0.085,tarta,carrefour
2781,5031,Pienso de pollo y cereales para gato pelaje y bolas de pelo Purina ONE Bifensis 800 g,4.15,0.8,kg,0.8,cereales,carrefour
2782,5032,Pienso de pollo y cereales para perros adultos Dream 4 Kg.,3.89,4.01,kg,4.01,cereales,carrefour
2783,5033,Pienso de pollo y cereales para perros de razas pequenas Dream 3 Kg.,2.95,3.01,kg,3.01,cereales,carrefour
2784,5038,Comida humeda de salmon y pollo en salsa para gato adulto Purina Gourmet Gold 85 g,0.73,0.085,kg,0.085,salsa,carrefour
2785,5044,Comida humeda de buey. ternera y cordero para gato Purina Gourmet Mon Petit 6x50 g.,2.59,0.3,kg,0.3,cordero,carrefour
2786,5049,Pienso de pollo y arroz para perro adulto Ultima 3 Kg.,10.95,3.0,kg,3.0,arroz,carrefour
2787,5051,Ultima Pienso para Gato Adulto Sabor pollo y arroz 3kg.,14.69,2.998,kg,2.998,arroz,carrefour
2788,5052,Pienso de conejo. pollo y verduras para gato adulto Purina Friskies 1.5 Kg,3.99,1.5,kg,1.5,conejo,carrefour
2789,5060,Lata Pate con Salmon para Gatos 400 gr,0.65,0.401,kg,0.401,pate,carrefour
2790,5066,Carrefour Pienso para Gato Junior de Pollo. Zanahoria y Leche 1.5Kg,3.25,1.498,kg,1.498,zanahoria,carrefour
2791,5076,Pienso de pollo y cereales para perros adultos Dream 10 Kg.,6.5,10.0,kg,10.0,cereales,carrefour
2792,5085,Comida humeda seleccion carnes mixtas en salsa para perro Cesar pack de 4 unidades de 100 g.,2.45,0.4,kg,0.4,salsa cesar,carrefour
2793,5086,Pienso de pavo y cereales para gato adulto de interior Purina ONE Bifensis 1.5 Kg,7.65,1.5,kg,1.5,pechuga de pavo,carrefour
2794,5088,Multicroquetas para Gato 2 Kg. Carrefour,2.35,2.009,ud,2.009,croquetas,carrefour
2795,5089,Bocaditos de carne de pate higado para gato Vitakraft Yums 40 g.,1.79,0.04,kg,0.04,pate,carrefour
2796,5092,Pienso de pollo y cereales para gato juniorPurina ONE Bifensis 450 g,2.49,0.45,kg,0.45,cereales,carrefour
2797,5096,Pienso semihumedo de buey. zanahorias y cereales para perros adultos Frolic 4 kg.,12.85,4.003,kg,4.003,cereales,carrefour
2798,5097,Ultima Pienso para Gato control bolas de pelo Sabor Pavo 1.5kg,7.85,1.501,kg,1.501,pechuga de pavo,carrefour
2799,5102,Pienso de pollo y arroz para perro adulto Medium Maxi Ultima 7Kg.,27.25,7.005,kg,7.005,arroz,carrefour
2800,5103,Lata Pate con Pollo para Gatos 400 gr,0.65,0.401,kg,0.401,pate,carrefour
2801,5110,Pienso de buey y arroz para perro adulto Mini Purina One 1.5 Kg.,5.89,1.499,kg,1.499,arroz,carrefour
2802,5113,Lata Pate de conejo para Gato 400 gr. Carrefour,0.65,0.401,kg,0.401,conejo,carrefour
2803,5115,Pienso de pollo y arroz para perro adulto Mini Purina One Active 1.5 Kg.,5.89,1.499,kg,1.499,arroz,carrefour
2804,5117,Comida humeda surtido de carne para gato adulto Purina Felix Sensations Gelatinas Seleccion 4x100 g ,2.09,0.4,kg,0.4,gel de ducha,carrefour
2805,5121,Pienso de pollo y arroz para perros cachorros Dream 4 Kg.,3.45,4.012,kg,4.012,arroz,carrefour
2806,5124,Snack de queso y buey para perro Pedigree Tasty Bites Cheesy 140 g.,2.95,0.08,kg,0.08,queso,carrefour
2807,5126,Bolsas para Gatos Pack de 4x100 gr Trocitos de Carne en Salsa,1.18,0.4,kg,0.4,salsa,carrefour
2808,5129,Pienso de pollo y cereales para gato adulto Purina ONE Bifensis 1.5 Kg,7.65,1.5,kg,1.5,cereales,carrefour
2809,5131,Ultima Pienso para Gato Adulto Sabor salmon y arroz 1.5kg,7.85,1.501,kg,1.501,arroz,carrefour
2810,5144,Comida humeda de pollo y verdura en salsa para gato adulto Poesie 85 g.,0.59,0.085,kg,0.085,salsa,carrefour
2811,5152,Bastones de zanahoria para conejos enanos Vitakraft50 grs,1.79,0.05,kg,0.05,conejo,carrefour
2812,5160,Comida humeda de pavo con salsa de queso para gato adulto Poesie 85 g.,0.59,0.085,kg,0.085,pechuga de pavo,carrefour
2813,5164,Snacks de pollo y queso para gatos Whiskas Temptations 60 g.,2.15,1.0,ud,1.0,queso,carrefour
2814,5165,Pienso de pavo y arroz para gato adulto digestion sensible Purina ONE Bifensis 800 g,4.15,0.8,kg,0.8,arroz,carrefour
2815,5172,Pienso de cordero para perro adulto medium maxi Ultima Nature 3 Kg.,14.79,3.0,kg,3.0,cordero,carrefour
2816,5174,Pienso de buey y arroz para perro adulto Mini Purina One 800 g.,3.09,0.801,kg,0.801,arroz,carrefour
2817,5176,Comida humeda de pollo y cordero para perro adulto Mini Purina One 4x100 g.,2.49,0.4,kg,0.4,cordero,carrefour
2818,5182,Croquetas de buey para perro cachorro Carrefour 4 Kg.,4.89,4.008,kg,4.008,croquetas,carrefour
2819,5192,Trocitos de buey y pollo en salsa de verduras 12x100 g.,2.95,1.199,kg,1.199,salsa,carrefour
2820,5193,Vitakraft Menu para Conejos Enanos 1Kg,3.39,1.0,kg,1.0,conejo,carrefour
2821,5201,Pienso de buey. verduras y cereales para perros Brekkies Excel 10 Kg.,18.9,10.0,kg,10.0,cereales,carrefour
2822,5206,Latita Vitakraft Poesie de Salsa con Ternera y Zanahoria 85 gr,0.59,0.085,kg,0.085,zanahoria,carrefour
2823,5207,Braky Huesitos Rellenos 200 grs,3.5,0.2,kg,0.2,chocolatinas,carrefour
2824,5209,Comida humeda seleccion carnes en salsa para gatos Whiskas pack de 4 unidades de 100 g.,1.81,0.4,kg,0.4,salsa,carrefour
2825,5216,Barritas de miel para periquitos Vitakraft2 uds,1.4,2.0,ud,2.0,miel,carrefour
2826,5217,Barritas de miel para hamster Vitakraft 2 ud.,2.59,2.008,ud,2.008,miel,carrefour
2827,5218,Barritas de miel para conejos enanos Vitakraft 2 ud.,2.59,2.008,ud,2.008,miel,carrefour
2828,5219,Nutricroquetas para Gato 2 Kg. Carrefour,2.35,2.009,kg,2.009,croquetas,carrefour
2829,5222,Comida humeda de salsa con pescado. pasta y tomate para gato adulto Poesie 85 g.,0.59,0.085,kg,0.085,tomate,carrefour
2830,5229,Pienso de cordero para perro adulto mini Ultima Nature 1.25 Kg.,8.75,1.25,kg,1.25,cordero,carrefour
2831,5230,Snack de Huesos de cordero 100% naturales para perros Vitakraft 80 g.,2.95,0.08,kg,0.08,cordero,carrefour
2832,5242,Pienso con aves. verduras y cereales para perro adulto Brekkies Delicious 3 Kg.,6.95,2.996,kg,2.996,cereales,carrefour
2833,5250,Menu Aroma para Conejos Enanos 5 kg,12.3,5.0,kg,5.0,conejo,carrefour
2834,5253,Pienso de pollo y arroz para perro senior Mini Purina One 1.5 Kg.,5.89,1.499,kg,1.499,arroz,carrefour
2835,5256,Pienso de buey. cereales y verduras para perro adulto Purina Friskies 10 Kg.,16.65,10.03,kg,10.03,cereales,carrefour
2836,5262,Barritas para Periquitos Vitakraft Kiwi 2 Uds,1.4,2.0,ud,2.0,kiwis,carrefour
2837,5264,Champu espuma seca para perros cachorros SanDimas 200 ml,4.75,1.0,ud,1.0,champu,carrefour
2838,5271,Pienso de pollo y cereales para gato adulto pelaje y bolas de peloPurina ONE 1.5 Kg,7.65,1.5,kg,1.5,cereales,carrefour
2839,5273,Pienso de pollo y arroz para perro cachorros Medium Ultima 3 Kg.,12.19,3.002,kg,3.002,arroz,carrefour
2840,5278,Pienso de pollo y arroz para perros Junior Brekkies 3 Kg.,10.25,2.997,kg,2.997,arroz,carrefour
2841,5282,Pienso de buey y arroz para perro Mini Purina One 3 Kg.,11.65,3.003,kg,3.003,arroz,carrefour
2842,5284,Pienso de buey. cereales y verduras para perro adulto Purina Friskies 3 Kg.,5.79,3.0,kg,3.0,cereales,carrefour
2843,5288,Barritas para Agapornis Vitakraft Miel,3.69,1.0,ud,1.0,miel,carrefour
2844,5290,Champu espuma seca para gatos SanDimas 200 ml,4.75,1.0,ud,1.0,champu,carrefour
2845,5297,Comida de humeda de gelatina con salmon y espinacas para gato adulto 85 g.,0.59,0.085,kg,0.085,gel de ducha,carrefour
2846,5299,Ultima Nature No Grain Gato Adulto Pavo 1.10 kg,8.69,1.1,kg,1.1,pechuga de pavo,carrefour
2847,5324,Pienso de pollo y arroz para perro adulto Mini Purina One Active 3 Kg.,11.65,3.003,kg,3.003,arroz,carrefour
2848,5325,Pienso de pollo y cereales para gato senior +11anos Purina ONE 1.5 Kg,7.65,1.5,kg,1.5,cereales,carrefour
2849,5328,Pienso de pavo fresco. verduras y frutas para perro adulto mini Ultima Nature No Grain1.1 Kg.,8.65,1.101,kg,1.101,pechuga de pavo,carrefour
2850,5342,Pienso de pollo con arroz para perro adulto Purina Beyond Bio 700 g.,7.59,0.7,kg,0.7,arroz,carrefour
2851,5355,Pienso de buey y arroz para perro adulto Mini Purina One piel y pelaje 1.5 Kg.,5.89,1.499,kg,1.499,arroz,carrefour
2852,5360,Comida humeda de pollo y cordero en gelatina para perro Pedigree pack de 4 unidades de 100 g.,1.99,0.1,kg,0.1,cordero,carrefour
2853,5368,Comida Humeda de pavo y ternera para perro cachorro Cesar 150 g.,1.15,0.15,kg,0.15,pechuga de pavo,carrefour
2854,5380,Comida humeda esterilizada de pescado y pavo para gatos Perfect Fit pack de 4 unidades de 85 g.,2.75,0.34,kg,0.34,pechuga de pavo,carrefour
2855,5384,Pienso de cordero y cebada integral para perro adulto Purina Beyond 3 Kg.,12.95,2.998,kg,2.998,cordero,carrefour
2856,5385,Pienso de cordero y cebada integral para perro adulto Purina Beyond 1.4 Kg.,7.75,1.399,kg,1.399,cordero,carrefour
2857,5388,Pienso de pollo y arroz para perro Junior Mini Purina One 800 g.,3.09,0.801,kg,0.801,arroz,carrefour
2858,5389,Pienso de pollo y arroz para perro adulto Mini Purina One Dental 800 g.,3.09,0.801,kg,0.801,arroz,carrefour
2859,5390,Pienso de pavo y verduras para gato adulto esterilizado Purina Friskies 1.5 Kg,4.79,1.502,kg,1.502,pechuga de pavo,carrefour
2860,5399,Pienso de pavo y verduras para gato adulto esterilizado Pavo y Verduras Purina Friskies 3Kg,8.39,2.996,kg,2.996,pechuga de pavo,carrefour
2861,5405,Pienso de pollo. pavo y verduras para gato adulto Purina Felix 950 g.,3.55,0.949,kg,0.949,pechuga de pavo,carrefour
2862,5409,Comida humeda de salmon y pavo para gatos Purina One Esterilizados 4x85 g,2.99,0.34,kg,0.34,pechuga de pavo,carrefour
2863,5437,Pienso de pavo fresco. verduras y frutas para perro adulto medium maxi Ultima Nature No Grain2.7 Kg.,14.69,2.7,kg,2.7,pechuga de pavo,carrefour
2864,5441,Champu anticaida para perro Carrefour 250 Ml,3.49,0.25,L,0.25,champu,carrefour
2865,5442,Champu 2en1 para perro Carrefour 250 Ml,3.49,0.25,L,0.25,champu,carrefour
2866,5443,Champu para perro Carrefour uso frecuente 250 Ml,3.49,0.25,L,0.25,champu,carrefour
2867,5444,Champu para perro Carrefour uso frecuente 1L,6.25,1.0,L,1.0,champu,carrefour
2868,5445,Champu de Espuma para Gatos Pelo Seco 150 Ml. Carrefour,4.25,0.15,L,0.15,champu,carrefour
2869,5458,Carrefour Comida para Conejos 800g,1.95,0.799,kg,0.799,conejo,carrefour
2870,5463,Carrefour Barritas para Conejos con Frutas 2x55g,1.45,1.0,ud,1.0,conejo,carrefour
2871,5464,Carrefour Barritas para Canarios de Miel 2x60g,0.99,1.0,ud,1.0,miel,carrefour
2872,5472,Barritas para Loro Africano Vitakraft Miel,4.0,1.0,ud,1.0,miel,carrefour
2873,5478,Carrefour Comida para Conejos 3Kg,6.95,2.996,kg,2.996,conejo,carrefour
2874,5487,Champu 3en1 Dixie 500 ml,3.79,1.0,ud,1.0,champu,carrefour
2875,5499,Champu antiparasitario Dixie 750 ml,7.95,0.75,L,0.75,champu,carrefour
2876,5500,Desodorante suavizante Champu 2en1 para perros Dixie 750 Ml,5.42,0.75,L,0.75,champu,carrefour
2877,5501,Champu repelente de insectos Dixie 350 Ml,4.39,0.35,L,0.35,champu,carrefour
2878,5504,Silica de gel aglomerante para gatos2.2 Kg.,4.5,2.195,kg,2.195,gel de ducha,carrefour
2879,5511,Pienso de salmon y arroz para gato facil digestion Ultima Cat 750 g.,4.15,0.75,kg,0.75,arroz,carrefour
2880,5512,Pienso pavo con verduras para gato bolas de pelo Ultima Cat 750 g.,4.29,0.75,kg,0.75,pechuga de pavo,carrefour
2881,5513,Barra Arroz y Zanahoria Canibaq 1 kg ,1.35,1.0,kg,1.0,arroz,carrefour
2882,5534,Carrefour Comida para Conejos Snoby 500g,0.79,0.5,kg,0.5,conejo,carrefour
2883,5540,Pienso de cordero. cereales. verduras y frutas para perro adulto medium maxi Ultima Nature7 Kg.,27.25,7.005,kg,7.005,cordero,carrefour
2884,5541,Pienso de pollo. cereales. verduras y frutas para perros adultos Ultima Nature Medium Maxi 7 Kg.,27.25,7.005,kg,7.005,cereales,carrefour
2885,5544,Alimento Humedo para Gato con Atun y Zanahorias 400gr,0.31,0.403,kg,0.403,zanahoria,carrefour
2886,5545,Alimento Humedo para Gato con Buey y Zanahorias 400gr,0.31,0.403,kg,0.403,zanahoria,carrefour
2887,5550,Pienso de salmon y arroz para gato adulto digestion sensible Purina ONE Bifensis1.5 Kg,7.65,1.5,kg,1.5,arroz,carrefour
2888,5552,Comida humeda surtido de verduras para gato Purina Felix Fantastic Gelatina Seleccion 4x100 g,2.15,0.4,kg,0.4,gel de ducha,carrefour
2889,5553,Snacks de queso para gatos Catisfactions 60 g.,1.45,0.06,kg,0.06,queso,carrefour
2890,5556,Comida para conejos enanos Menu Aroma Vitakraft3Kg.,8.7,3.0,kg,3.0,conejo,carrefour
2891,5561,Dentifrico con fluor anti-caries sabor menta Bi-Fluore 250 mg Fluocaril pack de 2 unidades de 150 ml.,8.55,0.25,L,2.5,dentifrico,carrefour
2892,5562,Gel dermatologico ph 5.5 con colageno y lipo-proteinas Inibsa pack de 2 unidades de 1 l.,7.29,2.025,L,20.25,gel de ducha,carrefour
2893,5563,Dentifrico menta fresca Repair & Protect Sensodyne pack 2 unidades de 75 ml.,8.29,0.15,L,1.499,dentifrico,carrefour
2894,5565,Gel de bano suave cuerpo y cabello Mustella 500 ml.,9.39,0.499,L,4.995,gel de ducha,carrefour
2895,5566,Dentifrico antiplaca y anticaries Lacer pack de 2 unidades de 125 ml.,9.95,0.25,L,2.5,dentifrico,carrefour
2896,5567,Enjuague bucal Gingilacer 1000 ml.,14.59,0.999,L,9.993,enjuague bucal,carrefour
2897,5568,Tarrito de menestra de cordero desde 6 meses Nutriben 235 g.,0.99,0.235,kg,0.235,cordero,carrefour
2898,5569,Dentifrico para el cuidado de las encias herbal fresh Parodontax pack de 2 unidades de 75 ml.,9.39,0.15,L,1.5,dentifrico,carrefour
2899,5575,Dentifrico Junior de fresa Fluor Kin 75 ml.,3.99,0.075,L,0.75,dentifrico,carrefour
2900,5576,Tarrito de jamon y ternera con menestra de verduras desde los 6 meses Nutriben Potitos 235 g.,0.99,0.235,kg,0.235,menestra congelada,carrefour
2901,5577,Apositos Universal Surtido 4 tamanos Hansaplast 40 ud.,2.49,41.5,ud,41.5,sal,carrefour
2902,5580,Dentifrico infantil de 2 a 6 anos Fluor Kin 100 ml.,4.39,0.075,L,0.75,dentifrico,carrefour
2903,5582,Tarrito de ternera con patatas y zanahorias desde los 6 meses Nutriben Potitos 235 g.,0.99,0.235,kg,0.235,zanahoria,carrefour
2904,5584,Dentifrico Encias Vitis 100 ml.,6.09,0.1,L,1.0,dentifrico,carrefour
2905,5585,Dentifrico menta fresca Repair & Protect Sensodyne pack 2 unidades de 75 ml.,8.29,0.15,L,1.499,dentifrico,carrefour
2906,5586,Tarrito de menestra de cordero desde 6 meses Nutriben 235 g.,0.99,0.235,kg,0.235,cordero,carrefour
2907,5587,Dentifrico para el cuidado de las encias herbal fresh Parodontax pack de 2 unidades de 75 ml.,9.39,0.15,L,1.5,dentifrico,carrefour
2908,5589,Tarrito de pollo con guisantes y zanahorias desde 6 meses Nutriben 235 g.,0.99,0.235,kg,0.235,guisantes congelados,carrefour
2909,5591,Alcohol de romero Carrefour 250 ml.,1.99,0.249,L,2.488,romero,carrefour
2910,5594,Tarrito de pollo con guisantes y zanahorias desde 6 meses Nutriben 235 g.,0.99,0.235,kg,0.235,guisantes congelados,carrefour
2911,5595,Dentifrico para el cuidado de las encias original menta y jengibre Parodontax pack de 2 unidades de 75 ml.,9.39,0.15,L,1.5,dentifrico,carrefour
2912,5599,Dentifrico control Duplo Parogencyl pack de 2 unidades de 125 ml.,6.89,0.25,L,2.496,dentifrico,carrefour
2913,5600,Tarrito de guiso de pollo y ternera con judias verdes desde 6 meses Nutriben 235 g.,0.99,0.235,kg,0.235,judias verdes congeladas,carrefour
2914,5604,Dentifrico plus fluor Desensin pack de 2 unidades de 125 g.,6.19,1.0,ud,1.0,dentifrico,carrefour
2915,5606,Tarrrito de ternera con judias verdes y zanahorias desde 6 meses Nutriben 235 g.,0.99,0.235,kg,0.235,judias verdes congeladas,carrefour
2916,5607,Dentifrico original Parodontax 75 ml.,5.25,0.075,L,0.75,dentifrico,carrefour
2917,5610,Dentifrico blanqueadora con fluor Lacer Blanc 125 ml.,7.55,0.125,L,1.25,dentifrico,carrefour
2918,5611,Dentifrico anti-caries sabor menta Bi-Fluore 250 Fluocaril 125 ml.,5.09,0.125,L,1.251,dentifrico,carrefour
2919,5614,Dentifrico menta fresca Repair & Protect Sensodyne pack 2 unidades de 75 ml.,8.29,0.15,L,1.499,dentifrico,carrefour
2920,5615,Tarrito de menestra de cordero desde 6 meses Nutriben 235 g.,0.99,0.235,kg,0.235,cordero,carrefour
2921,5616,Dentifrico para el cuidado de las encias herbal fresh Parodontax pack de 2 unidades de 75 ml.,9.39,0.15,L,1.5,dentifrico,carrefour
2922,5618,Tarrito de pollo con guisantes y zanahorias desde 6 meses Nutriben 235 g.,0.99,0.235,kg,0.235,guisantes congelados,carrefour
2923,5619,Dentifrico blanqueadora Vitis 100 ml.,6.95,0.1,L,1.0,dentifrico,carrefour
2924,5621,Dentifrico tratante en sensibilidad dental SensiLacer 125 ml.,6.95,0.125,L,1.25,dentifrico,carrefour
2925,5624,Dentifrico blanqueador Fluocaril pack de 2 unidades de 75 ml.,7.09,0.15,L,1.499,dentifrico,carrefour
2926,5625,Tarrito de pollo con arroz desde 6 meses Nutriben 235 g.,0.99,0.235,kg,0.235,arroz,carrefour
2927,5630,Dentifrico proteccion completa Parodontax 75 ml.,6.19,0.075,L,0.75,dentifrico,carrefour
2928,5642,Gel reparador Vaseline 100 ml.,2.49,0.1,L,1.0,gel de ducha,carrefour
2929,5643,Dentifrico menta fresca Repair & Protect Sensodyne pack 2 unidades de 75 ml.,8.29,0.15,L,1.499,dentifrico,carrefour
2930,5644,Tarrito de menestra de cordero desde 6 meses Nutriben 235 g.,0.99,0.235,kg,0.235,cordero,carrefour
2931,5645,Dentifrico para el cuidado de las encias herbal fresh Parodontax pack de 2 unidades de 75 ml.,9.39,0.15,L,1.5,dentifrico,carrefour
2932,5647,Tarrito de pollo con guisantes y zanahorias desde 6 meses Nutriben 235 g.,0.99,0.235,kg,0.235,guisantes congelados,carrefour
2933,5651,Dentifrico blanqueante sabor menta Lacer 150 ml.,7.39,0.15,L,1.499,dentifrico,carrefour
2934,5652,Desodorante roll-on anti-transpirante 48h. Vichy 50 ml.,7.69,0.05,L,0.5,desodorante,carrefour
2935,5655,Crema pies ultra-hidratante Neutrogena pack de 2 unidades de 100 ml.,12.69,0.2,L,2.002,crema hidratante,carrefour
2936,5659,Caramelo sabor arandano rojo sin azucar Ricola 50 g.,2.29,0.05,kg,0.5,caramelos,carrefour
2937,5660,Gel intima odor block Vagisil 250 ml.,6.55,0.25,L,2.5,gel de ducha,carrefour
2938,5662,Papilla Infantil Blevit Plus Duplo 8 Cereales y Fruta 600 gr,9.19,0.6,kg,0.6,papilla,carrefour
2939,5664,Pastillas de regaliz Juanola 6 g.,1.41,0.006,kg,0.06,golosinas,carrefour
2940,5665,Pastillas de regaliz Juanola 27 g.,4.19,0.027,kg,0.27,golosinas,carrefour
2941,5672,Dentifrico menta fresca Repair & Protect Sensodyne pack 2 unidades de 75 ml.,8.29,0.15,L,1.499,dentifrico,carrefour
2942,5673,Tarrito de menestra de cordero desde 6 meses Nutriben 235 g.,0.99,0.235,kg,0.235,cordero,carrefour
2943,5674,Dentifrico para el cuidado de las encias herbal fresh Parodontax pack de 2 unidades de 75 ml.,9.39,0.15,L,1.5,dentifrico,carrefour
2944,5676,Tarrito de pollo con guisantes y zanahorias desde 6 meses Nutriben 235 g.,0.99,0.235,kg,0.235,guisantes congelados,carrefour
2945,5677,Dentifrico sin fluor Parodontax 75 ml.,5.85,0.075,L,0.75,dentifrico,carrefour
2946,5681,Dentifrico herbal fresh Parodontax 75 ml.,5.25,0.075,L,0.75,dentifrico,carrefour
2947,5683,Enjuague bucal antiseptico Oraldine 200 ml.,4.49,0.2,L,2.004,enjuague bucal,carrefour
2948,5686,Caramelo sabor naranja y menta sin azucar Ricola 50 g.,2.29,0.05,kg,0.5,caramelos,carrefour
2949,5689,Dentifrico clorhexidina tratamiento gingivitis Lacer 75 ml.,6.29,0.075,L,0.75,dentifrico,carrefour
2950,5690,Desodorante roll-on anti-transpirante piel sensible o depilada 48h. Vichy 50 ml.,7.69,0.05,L,0.5,desodorante,carrefour
2951,5694,Papilla infantil desde 6 meses avena integrar con ciruela sin azucar anadido Gerber 250 ml. ,4.05,0.25,kg,0.25,papilla,carrefour
2952,5695,Caramelo sabor menta montana sin azucar Ricola 50 g.,2.29,0.05,kg,0.5,caramelos,carrefour
2953,5701,Dentifrico menta fresca Repair & Protect Sensodyne pack 2 unidades de 75 ml.,8.29,0.15,L,1.499,dentifrico,carrefour
2954,5702,Tarrito de menestra de cordero desde 6 meses Nutriben 235 g.,0.99,0.235,kg,0.235,cordero,carrefour
2955,5703,Dentifrico para el cuidado de las encias herbal fresh Parodontax pack de 2 unidades de 75 ml.,9.39,0.15,L,1.5,dentifrico,carrefour
2956,5705,Tarrito de pollo con guisantes y zanahorias desde 6 meses Nutriben 235 g.,0.99,0.235,kg,0.235,guisantes congelados,carrefour
2957,5707,Gel limpiador espumoso Cerave 473 ml.,11.49,0.473,L,4.728,gel de ducha,carrefour
2958,5722,Dentifrico especial para portadores de ortodoncia Vitis 100 ml.,6.75,0.1,L,1.0,dentifrico,carrefour
2959,5723,Leche de continuacion Almiron Profutura 2 800 g.,23.1,0.8,kg,0.8,leche para bebes,carrefour
2960,5726,Aceite de almendras Phytofarma 500 ml.,8.69,0.499,L,4.994,almendras,carrefour
2961,5728,Limpiador gel de agua elimina las impurezas y el maquillaje Hydro Boost Neutrogena 200 ml.,10.89,0.2,L,2.002,agua otro,carrefour
2962,5730,Dentifrico menta fresca Repair & Protect Sensodyne pack 2 unidades de 75 ml.,8.29,0.15,L,1.499,dentifrico,carrefour
2963,5731,Tarrito de menestra de cordero desde 6 meses Nutriben 235 g.,0.99,0.235,kg,0.235,cordero,carrefour
2964,5732,Dentifrico para el cuidado de las encias herbal fresh Parodontax pack de 2 unidades de 75 ml.,9.39,0.15,L,1.5,dentifrico,carrefour
2965,5734,Tarrito de pollo con guisantes y zanahorias desde 6 meses Nutriben 235 g.,0.99,0.235,kg,0.235,guisantes congelados,carrefour
2966,5735,Oleogel de ducha pH5 para piel sensible y seca Eucerin 1000 ml.,22.8,1.0,L,10.0,gel de ducha,carrefour
2967,5736,Oleogel de ducha pH5 para pieles sensibles y secas Eucerin 400 ml.,12.99,0.4,L,3.997,gel de ducha,carrefour
2968,5737,Papilla infantil desde 4 meses cereales ecologica Almiron sin gluten sin lactosa sin aceite de palma 200 g.,4.05,0.2,kg,0.2,papilla,carrefour
2969,5738,Colutorio enjuague bucal diario Lacer 500 ml.,7.75,0.5,L,5.0,enjuague bucal,carrefour
2970,5742,Gel de bano pH5 para piel sensible Eucerin 1000 ml.,17.15,0.997,L,9.971,gel de ducha,carrefour
2971,5743,Polvos desodorantes para pies Devor-Olor 100 g.,5.25,0.1,kg,1.0,desodorante,carrefour
2972,5747,Preparado Lacteo de crecimiento desde los 12 meses Blemil Plus 3 lata 800 g.,15.49,0.8,kg,0.8,leche para bebes,carrefour
2973,5748,Infusion Infantil Blevit Digest 150 gr,8.19,0.15,kg,0.15,infusiones otras,carrefour
2974,5752,Tonico Agua de Rosas Genove 500 ml.,4.69,0.499,L,4.989,agua otro,carrefour
2975,5754,Champu extracto de ortiga Xensium Nature 500 ml.,6.55,0.5,L,5.0,champu,carrefour
2976,5759,Dentifrico menta fresca Repair & Protect Sensodyne pack 2 unidades de 75 ml.,8.29,0.15,L,1.499,dentifrico,carrefour
2977,5760,Tarrito de menestra de cordero desde 6 meses Nutriben 235 g.,0.99,0.235,kg,0.235,cordero,carrefour
2978,5761,Dentifrico para el cuidado de las encias herbal fresh Parodontax pack de 2 unidades de 75 ml.,9.39,0.15,L,1.5,dentifrico,carrefour
2979,5763,Tarrito de pollo con guisantes y zanahorias desde 6 meses Nutriben 235 g.,0.99,0.235,kg,0.235,guisantes congelados,carrefour
2980,5776,Papilla infantil desde 6 meses 8 cereales sin azucar anadido Gerben 250 g.,3.69,0.25,kg,0.25,papilla,carrefour
2981,5777,Gel lubricante vaginal Vagisil 30 g.,7.69,0.03,kg,0.3,gel de ducha,carrefour
2982,5781,Dentifrico Lacer Fresh 125 ml.,4.95,0.125,L,1.25,dentifrico,carrefour
2983,5783,Gel limpiador facial DermatoClean Eucerin 200 ml.,10.09,0.2,L,2.002,gel de ducha,carrefour
2984,5788,Dentifrico menta fresca Repair & Protect Sensodyne pack 2 unidades de 75 ml.,8.29,0.15,L,1.499,dentifrico,carrefour
2985,5789,Tarrito de menestra de cordero desde 6 meses Nutriben 235 g.,0.99,0.235,kg,0.235,cordero,carrefour
2986,5790,Dentifrico para el cuidado de las encias herbal fresh Parodontax pack de 2 unidades de 75 ml.,9.39,0.15,L,1.5,dentifrico,carrefour
2987,5792,Tarrito de pollo con guisantes y zanahorias desde 6 meses Nutriben 235 g.,0.99,0.235,kg,0.235,guisantes congelados,carrefour
2988,5794,Aceite de almendras + rosa mosqueta Phytofarma 250 ml.,7.25,0.25,L,2.5,almendras,carrefour
2989,5795,Champu solido 2 en 1 Ecologico Nutricion Dr. Tree 75 gr.,10.45,0.075,kg,0.75,champu,carrefour
2990,5796,Infusion Infantil Blevit Sueno 150 gr,8.19,0.15,kg,0.15,infusiones otras,carrefour
2991,5798,Gel de ducha Lipikar La Roche-Posay 1 ud.,13.85,0.749,L,7.486,gel de ducha,carrefour
2992,5800,Desodorante roll on pH5 para pieles sensibles Eucerin pack de 2 unidades de 50 ml.,8.49,0.1,L,1.0,desodorante,carrefour
2993,5803,Desodorante roll on antitranspirante 48h Eucerin pack de 2 unidades de 50 ml.,8.49,0.1,L,1.0,desodorante,carrefour
2994,5809,Dentifrico ortodoncia sabor lima frescaOrtoLacer 125 ml.,6.35,0.125,L,1.25,dentifrico,carrefour
2995,5810,Gel Multidermol 750 ml.,6.09,0.752,L,7.519,gel de ducha,carrefour
